0,1,2,Широта,Долгота
Гостиница «Мама Леоне отель» ИП Шабаев Александр Антонович,ИП Шабаев Александр Антонович,"164509, г. Северодвинск, ул. Адмирала Нахимова, д. 3",64.592873,39.810576
Гостиница «Никольская гавань» ИП Морев Василий Викторович,ИП Морев Василий Викторович,"164509, Архангельская обл., г. Северодвинск, ул. Октябрьская, д. 3",64.597080,39.820277
КОМПЛЕКС АПАРТАМЕНТОВ «APART HOUSE CM»\tИП Засухин Александр Анатольевич,ИП Засухин Александр Анатольевич,"163000, Архангельская область, г. Архангельск, ул. Выучейского, 14",64.531160,40.539149
"База отдыха ""Медвежий угол"" ИП (КФХ) Курицын Юрий Александрович",ИП (КФХ) Курицын Юрий Александрович,"Архангельская обл., с. Красноборск, ул. Гагарина, д. 135, К1",61.559224,45.907944
"Мини-отель ""Гостиный дворик"" ИП Юрьев Андрей Анатольевич",ИП Юрьев Андрей Анатольевич,"Архангельская область, с. Красноборск, ул. Свердлова, д.13 а",61.558710,45.942844
Гостиница «Альянс» ООО «Альянс»,Общество с ограниченной ответственностью «Альянс»,"163016, Архангельская  обл., г. Архангельск, ул. Октябрьская, д. 3",64.491741,40.698430
Отель «Flagman» ИП Гусейнов Низамаддин Сахиб оглы,ИП Гусейнов Низамаддин Сахиб оглы,"163071, г. Архангельск, ул. Тимме, д. 29",64.554205,40.554139
Гостиница на Макаренко-9 АО «ЦС «Звездочка»,АО «ЦС «Звездочка»,"Архангельская обл., г. Северодвинск, ул. Макаренко, д. 9",64.593298,39.794914
Гостиница на Мира-1 АО «ЦС «Звездочка»,АО «ЦС «Звездочка»,"Архангельская обл., г. Северодвинск, ул. Мира, д. 1",64.591706,39.803976
Гостиница на Октябрьской-47 АО «ЦС «Звездочка»,АО «ЦС «Звездочка»,"Архангельская обл., г. Северодвинск, ул. Октябрьская, д. 47",64.606661,39.813548
Гостиница АО «ЦС «Звездочка»,АО «ЦС «Звездочка»,"Архангельская обл., г. Северодвинск, ул. Северная, д. 4А",64.598210,39.803067
Гостиница «Заря» ФГУП «Управление гостиничным хозяйством» Минобороны России,ФГУП «Управление гостиничным хозяйством» Минобороны России,"Архангельская обл., г. Мирный, ул. Ленина, д. 34, корп. 1, 2, 3",62.757944,40.331940
"Гостиница ""Околица"" ООО ""Каскад""","ООО ""Каскад""","165780, Архангельская область, Ленский р-н., с. Яренск, ул. Кишерская, д. 3",62.165151,49.091816
«Гостиница-Мирный» АО «КБСМ»,АО «КБСМ»,"164170, Архангельская область, г. Мирный, ул. Мира, д.29",62.769421,40.335615
"Отель ""Прибрежный"" ИП Зыков Юрий Викторович",ИП Зыков Юрий Викторович,"164570, Архангельская область, Виноградовский р-н., п. Березник, ул. Набережная, д. 8",62.856644,42.732409
Отель «Hermitage» ИП Касьянова Яна Андреевна,ИП Касьянова Яна Андреевна,"164501, Архангельская область, г. Северодвинск, ул. Торцева, д. 28А",64.566848,39.824776
Санаторий «Беломорье» ООО «Фишка»,ООО «Фишка»,"Архангельская область, Приморский район, п. Беломорье, д.20",64.294096,40.890252
Гостиница «Ростов» ООО «Регион – Няндома»,ООО «Регион – Няндома»,"город Няндома, ул. Урицкого д.7",61.670201,40.201083
"Гостиница ""Меридиан"" ОАО ""СМП""","ОАО ""Северное морское пароходство""","163017, г. Архангельск, ул. Советская, д. 5",64.570170,40.523051
Гостиница «Двинская» ИП Хмарук Любовь Степановна,ИП Хмарук Любовь Степановна,"165502, Архангельская обл., Верхнетоемский  р-н, п. Двинской, ул. Лесная, д. 19",62.158396,45.121820
База отдыха «Кий-остров» ИП Степанов Алексей Петрович,ИП Степанов Алексей Петрович,"164840, Архангельская область, Белое море, остров Кий",63.995972,37.891702
Гостиница «Вилегодское подворье» ИП Марковский Виталий Вениаминович,ИП Марковский Виталий Вениаминович,"165680. Архангельская обл., Вилегодский р-н,  с. И-Подомское, ул. Спортивная, д. 3",61.122201,47.966892
Гостиница «Северные зори» ООО «Северные зори»,ООО «Северные зори»,"165720, РФ, Архангельская обл., Ленский район, п. Урдома,  ул Калинина, д.5",61.752865,48.502566
Загородный отель «Гостевой дом «Аленушка» ИП Цурко Елена Юрьевна,ИП Цурко Елена Юрьевна,"164840, Архангельская область, Онежский район, город Онега,  улица Мулина, дом 30",63.908116,38.116310
Гостиница «Комнаты отдыха» ИП Шиловская Светлана Александровна,Индивидуальный предприниматель Шиловская Светлана Александровна,"165300, Архангельская обл., г. Котлас, ул. Кирова, д. 64, Г",61.255994,46.626952
"Гостиница ФГАУ ДПО ""Архангельский АУЦ""","ФЕДЕРАЛЬНОЕ ГОСУДАРСТВЕННОЕ АВТОНОМНОЕ УЧРЕЖДЕНИЕ ДОПОЛНИТЕЛЬНОГО ПРОФЕССИОНАЛЬНОГО ОБРАЗОВАНИЯ ""АРХАНГЕЛЬСКИЙ АВИАЦИОННЫЙ УЧЕБНЫЙ ЦЕНТР""","Архангельская область,  п.Талажский авиагородок, ул.Аэропорт Архангельск,  д.5",64.593591,40.712114
Отель «Lime» ООО  «Гостиничный комплекс «Лазурит»,Общество с ограниченной ответственностью «Гостиничный комплекс «Лазурит»,"164500, Архангельская обл., г. Северодвинск, ул. Первомайская, д. 8",64.571478,39.838879
Хостел № 2 Федеральное государственное бюджетное образовательное учреждение высшего образования «Северный государственный медицинский университет» Министерства здравоохранения Российской Федерации,Федеральное государственное бюджетное образовательное учреждение высшего образования «Северный государственный медицинский университет» Министерства здравоохранения Российской Федерации,"г. Архангельск, Набережная Северной Двины, д. 139, корпус 2",64.565603,40.537807
Хостел № 1 Федеральное государственное бюджетное образовательное учреждение высшего образования «Северный государственный медицинский университет» Министерства здравоохранения Российской Федерации,Федеральное государственное бюджетное образовательное учреждение высшего образования «Северный государственный медицинский университет» Министерства здравоохранения Российской Федерации,"г. Архангельск, Набережная Северной Двины, д. 139",64.566503,40.538584
База отдыха «Лукоморье»,ООО «РеалКом»,"163530, Архангельская область, Приморский район, территория СНТ Транспортник, ул. База отдыха «РеалКом», стр. 11",64.673922,40.722491
"Гостиница АО ""ПО ""Севмаш""","АО ""ПО ""Севмаш""","Архангельская область, город Северодвинск, пр.Ленина, д.38",64.556831,39.830275
Гостиница «Каргополочка»,АО «Бизнес-центр-отель»,"164110, Архангельская обл., г. Каргополь, ул. Ленина, д. 83",61.507777,38.950332
Гостиница «Приют»,Индивидуальный предприниматель Григорьева Екатерина Сергеевна,"164070, Архангельская обл., Приморский р-он, пос. Соловецкий, ул. Приморская, д. 11",65.023111,35.703307
Гостиница «Отель Адмирал»,ИП Воронин Игорь Сергеевич,"163002, г. Архангельск, ул. Набережная Северной Двины, д. 32",64.530162,40.540232
Хостел «Feel Good»,Индивидуальный предприниматель Стефанков Александр Викторович,"163000, г. Архангельск, ул. Воскресенская, д. 11",64.540474,40.522692
"Гостиница на Ленина, 40 АО ПО ""Севмаш""","АО ПО ""Севмаш""","Архангельская область, город Северодвинск, пр.Ленина, д.40",64.556336,39.830481
"Гостиница на Трухинова АО ПО ""Севмаш""","АО ПО ""Севмаш""","Архангельская область, город Северодвинск, ул.Трухинова, д.3, стр.1",64.551674,39.762327
"Гостиница ""Волна"" АО ПО ""Севмаш""","АО ПО ""Севмаш""","Архангельская область, город Северодвинск, ул.Седова, д.8",64.562290,39.816970
Отель «Botanica»,Общество с ограниченной ответственностью «ДОМ НАД ДВИНОЙ»,"163069, Архангельская обл., г. Архангельск, ул. Садовая, д. 3",64.551995,40.517946
Гостевой дом «Морошка» ИП Орлова Дина Ивановна,ИП Орлова Дина Ивановна,"164110, Архангельская область, г. Каргополь, ул. Ленинградская, д. 63",61.506236,38.922544
ГОСТИНИЦА «ГОСТИНИЦА НА НАБЕРЕЖНОЙ» ИП Меньшаков Александр Александрович,ИП Меньшаков Александр Александрович,"165300, Архангельская область, г. Котлас, ул. Набережная, д. 17",61.253814,46.622174
Гостиница «LaStoria» Общество с ограниченной ответственностью «ЛАСТОРИА»,Общество с ограниченной ответственностью «ЛАСТОРИА»,"163051, Архангельская обл., г. Архангельск, пр-кт Дзержинского, д. 7, корп. 4",64.547287,40.574422
Гостиница «На Западной» ИП Сосновская Анна Андреевна,ИП Сосновская Анна Андреевна,"164010, Архангельская область, рп. Коноша, ул. Западная, д. 2",60.967523,40.212089
Гостиница «Форт Нокс» ООО «Форт Нокс»,ООО «Форт Нокс»,"163000, г. Архангельск, ул. Выучейского, д. 88, корп.2",64.543143,40.551641
Отель «Медведов» Общество с ограниченной ответственностью «Торговая компания Плесецк»,Общество с ограниченной ответственностью «Торговая компания Плесецк»,"164260, Архангельская обл., Плесецкий р-н, п. Плесецк, ул. 915 км",62.700444,40.294211
Хостел «Фреш» Общество с ограниченной ответственностью «Хостел Фреш»,Общество с ограниченной ответственностью «Хостел Фреш»,"163051, Архангельская обл., г. Архангельск, пр. Дзержинского, д. 11",64.549359,40.571660
Гостиница «MIXX центральная» Индивидуальный предприниматель Лебедева Ольга Анатольевна,Индивидуальный предприниматель Лебедева Ольга Анатольевна,"164010, Архангельская область, п. Коноша, ул. Советская, д. 29",60.974123,40.256360
Хостел «MIXX» Индивидуальный предприниматель Лебедева Ольга Анатольевна,Индивидуальный предприниматель Лебедева Ольга Анатольевна,"164010, Архангельская область, п. Коноша, ул. Первомайская, д. 44",60.964874,40.244180
Мини-отель «Макаров»  Общество с ограниченной ответственностью «Мини-отель «Макаровъ»,Общество с ограниченной ответственностью «Мини-отель «Макаровъ»,"163000, Архангельская обл., г. Архангельск, наб. Северной Двины, д. 62",64.531639,40.527925
"гостиница Федеральное автономное учреждение ""ЦРО КД"" МО РФ","Федеральное автономное учреждение ""ЦРО КД"" МО РФ","164170, Россия, Архангельская область, г. Мирный, ул. Ленина, дом 2",62.766726,40.317773
Гостиница «Отель на Первомайской» Индивидуальный предприниматель Семянникова Ольга Евгеньевна,Индивидуальный предприниматель Семянникова Ольга Евгеньевна,"164200 Архангельская область, г. Няндома, ул. Первомайская, д.31",61.665988,40.193581
Отель «Путник» ИП Панкратова Елена Сергеевна,ИП Панкратова Елена Сергеевна,"164262, Архангельская область, г. Плесецк, ул. Ленина, д. 2а",62.700594,40.280940
Гостиница «Дворец спорта г.Онега» МБУ ДО «Дворец спорта для детей и юношества»,Муниципальное бюджетное учреждение дополнительного образования «Дворец спорта для детей и юношества»,"164840, Архангельская область, г. Онега, переулок Спортивный, дом 1, строение 2",63.922963,38.127627
"Гостиница ""Рокот"" АО ""ГКНПЦ им. М.В. Хруничева""","АО ""ГКНПЦ им. М.В. Хруничева""","164170, Архангельская область, г. Мирный, ул. Ленина, д. 34",62.758122,40.331476
«Гостевой дома «Как у бабушки»  ФГБУ «Национальный парк «Кенозерский»,ФГБУ «Национальный парк «Кенозерский»,"164136, Архангельская область, Каргопольский район, д. Масельга",61.827223,38.037106
